{
  "$schema": "../schemas/profile.schema.json",
  "name": "Nicholas Burt",
  "jobTitle": "Software Engineer",
  "company": "Apple",
  "lead": "I build and test production systems in Swift, Python, and Java, with a focus on test automation and data integrity across distributed service pipelines.",
  "location": "Santa Clara, CA area",
  "educationSummary": "B.S. Computer Science, Sacramento State",
  "links": [
    { "id": "linkedin", "label": "LinkedIn", "url": "https://linkedin.com/in/nicholas-w-burt", "icon": "linkedin", "primary": true },
    { "id": "github", "label": "GitHub", "url": "https://github.com/NicBDev", "icon": "github", "primary": false },
    { "id": "resume", "label": "Get Resume", "url": "https://docs.google.com/document/d/17sx3yBcaRA0qfDNEySnXYD-C7CSR2kLrg3Gka1Cl86g/edit?usp=sharing", "icon": "document", "primary": false }
  ],
  "about": {
    "paragraphs": [
      "I'm a software engineer in Apple's IS&T Customer Systems group. My work spans Swift/XCUI automation, cross-system data integrity validation across distributed service pipelines, and behavioral testing of an LLM-based voice assistant. Before that I built a full-stack cloud application (AWS RDS, Cognito, IAM) as my academic capstone.",
      "I work best digging into logs and data rather than relying on assumptions — tracing a bug back through a distributed pipeline until the root cause is undeniable. I like building systems and processes that make repeated work easier, and I'm comfortable picking up new tools on the job. Lately that's meant pairing traditional test automation with AI-assisted engineering workflows: using Claude Code to navigate unfamiliar codebases, draft and review test scripts, and keep work aligned with team conventions."
    ],
    "facts": [
      { "label": "Role", "value": "Software Engineer, IS&T Customer Systems @ Apple" },
      { "label": "Location", "value": "Santa Clara, CA area" },
      { "label": "Focus", "value": "Test automation · Distributed systems validation · AI-assisted QE" },
      { "label": "Education", "value": "B.S. Computer Science, Sacramento State '24" }
    ]
  },
  "contact": {
    "heading": "Let's connect",
    "text": "The fastest way to reach me is LinkedIn, or open an issue / PR on anything you find on my GitHub.",
    "links": [
      { "linkId": "linkedin", "label": "Connect on LinkedIn" },
      { "linkId": "github", "label": "View GitHub" }
    ]
  }
}
